{
  "assetPath": "mockups/auth/login__default.png",
  "imageHash": "<COPY_FROM_MOCKUP_INVENTORY>",
  "classification": "screen",
  "screenKey": "auth-login",
  "screenTitle": "Login",
  "existingScreenCode": null,
  "featureCodes": [],
  "requirementCodes": [],
  "businessRuleCodes": [],
  "flowCodes": [],
  "routeHint": null,
  "platform": "web",
  "viewport": null,
  "state": "default",
  "variant": null,
  "sections": [],
  "fields": [],
  "actions": [],
  "visibleMessages": [],
  "navigation": [],
  "explicitRules": [],
  "accessibilityNotes": [],
  "openQuestions": [],
  "confidence": 0.8,
  "status": "analyzed"
}
